[
  {
    "id": "filesystem-mcp",
    "name": "Filesystem",
    "maintainer": "MCP Steering Group",
    "description": "Secure local file operations with configurable allow-listed directories — the reference server every local agent starts with.",
    "install": "npx -y @modelcontextprotocol/server-filesystem /path/to/allowed/dir",
    "transport": [
      "stdio"
    ],
    "official": true,
    "language": "typescript",
    "tools_exposed": 14,
    "requires_auth": false,
    "url": "https://github.com/modelcontextprotocol/servers/tree/main/src/filesystem",
    "docs_url": "https://modelcontextprotocol.io/",
    "clients": [
      "claude",
      "claude-code",
      "cursor",
      "vscode",
      "windsurf",
      "zed",
      "cline"
    ],
    "tags": [
      "files",
      "local",
      "reference",
      "essential"
    ],
    "verified": "2026-09-24",
    "verified_by": "@seed-import",
    "status": "active",
    "notes": "Always pass an explicit allow-listed root. Running it on `/` gives an agent write access to your whole machine."
  },
  {
    "id": "fetch-mcp",
    "name": "Fetch",
    "maintainer": "MCP Steering Group",
    "description": "Fetches a URL and converts it to clean markdown for the model, with robots.txt respect and chunked reading.",
    "install": "uvx mcp-server-fetch",
    "transport": [
      "stdio"
    ],
    "official": true,
    "language": "python",
    "tools_exposed": 1,
    "requires_auth": false,
    "url": "https://github.com/modelcontextprotocol/servers/tree/main/src/fetch",
    "clients": [
      "claude",
      "claude-code",
      "cursor",
      "vscode",
      "cline"
    ],
    "tags": [
      "web",
      "scraping",
      "markdown",
      "reference"
    ],
    "verified": "2026-09-24",
    "verified_by": "@seed-import",
    "status": "active"
  },
  {
    "id": "git-mcp",
    "name": "Git",
    "maintainer": "MCP Steering Group",
    "description": "Read, search and diff a local git repository — history-aware agents without shelling out to raw git.",
    "install": "uvx mcp-server-git --repository /path/to/repo",
    "transport": [
      "stdio"
    ],
    "official": true,
    "language": "python",
    "tools_exposed": 13,
    "requires_auth": false,
    "url": "https://github.com/modelcontextprotocol/servers/tree/main/src/git",
    "clients": [
      "claude",
      "claude-code",
      "cursor",
      "vscode",
      "cline"
    ],
    "tags": [
      "git",
      "version-control",
      "reference",
      "local"
    ],
    "verified": "2026-09-24",
    "verified_by": "@seed-import",
    "status": "active"
  },
  {
    "id": "memory-mcp",
    "name": "Memory (Knowledge Graph)",
    "maintainer": "MCP Steering Group",
    "description": "Persistent knowledge-graph memory stored as local JSON — gives an agent recall across sessions for free.",
    "install": "npx -y @modelcontextprotocol/server-memory",
    "transport": [
      "stdio"
    ],
    "official": true,
    "language": "typescript",
    "tools_exposed": 9,
    "requires_auth": false,
    "url": "https://github.com/modelcontextprotocol/servers/tree/main/src/memory",
    "clients": [
      "claude",
      "claude-code",
      "cursor",
      "vscode",
      "cline"
    ],
    "tags": [
      "memory",
      "knowledge-graph",
      "rdf",
      "essential"
    ],
    "verified": "2026-09-24",
    "verified_by": "@seed-import",
    "status": "active",
    "notes": "Pair with a free vector store (Qdrant or Chroma) when the graph grows past a few thousand entities."
  },
  {
    "id": "sequential-thinking-mcp",
    "name": "Sequential Thinking",
    "maintainer": "MCP Steering Group",
    "description": "Structured step-by-step reasoning with revision and branching — measurably improves multi-step agent plans.",
    "install": "npx -y @modelcontextprotocol/server-sequential-thinking",
    "transport": [
      "stdio"
    ],
    "official": true,
    "language": "typescript",
    "tools_exposed": 1,
    "requires_auth": false,
    "url": "https://github.com/modelcontextprotocol/servers/tree/main/src/sequentialthinking",
    "clients": [
      "claude",
      "claude-code",
      "cursor",
      "vscode",
      "cline"
    ],
    "tags": [
      "reasoning",
      "planning",
      "reference"
    ],
    "verified": "2026-09-24",
    "verified_by": "@seed-import",
    "status": "active"
  },
  {
    "id": "time-mcp",
    "name": "Time",
    "maintainer": "MCP Steering Group",
    "description": "Time and timezone conversion grounded in the host clock — stops agents hallucinating dates.",
    "install": "uvx mcp-server-time",
    "transport": [
      "stdio"
    ],
    "official": true,
    "language": "python",
    "tools_exposed": 4,
    "requires_auth": false,
    "url": "https://github.com/modelcontextprotocol/servers/tree/main/src/time",
    "clients": [
      "claude",
      "claude-code",
      "cursor",
      "vscode",
      "cline"
    ],
    "tags": [
      "time",
      "timezone",
      "reference"
    ],
    "verified": "2026-09-24",
    "verified_by": "@seed-import",
    "status": "active"
  },
  {
    "id": "everything-mcp",
    "name": "Everything (Test Server)",
    "maintainer": "MCP Steering Group",
    "description": "Reference server exercising every MCP primitive — the fastest way to test a new client or transport.",
    "install": "npx -y @modelcontextprotocol/server-everything",
    "transport": [
      "stdio",
      "http"
    ],
    "official": true,
    "language": "typescript",
    "requires_auth": false,
    "url": "https://github.com/modelcontextprotocol/servers/tree/main/src/everything",
    "clients": [
      "claude",
      "claude-code",
      "cursor",
      "vscode"
    ],
    "tags": [
      "testing",
      "reference",
      "development"
    ],
    "verified": "2026-09-24",
    "verified_by": "@seed-import",
    "status": "active"
  },
  {
    "id": "github-mcp",
    "name": "GitHub MCP Server",
    "maintainer": "GitHub",
    "description": "Repo automation, PRs, issues, code search and CI workflows — the most-starred MCP server in the ecosystem.",
    "install": "docker run -i --rm -e GITHUB_PERSONAL_ACCESS_TOKEN ghcr.io/github/github-mcp-server",
    "transport": [
      "stdio",
      "http"
    ],
    "official": true,
    "language": "go",
    "tools_exposed": 51,
    "requires_auth": true,
    "auth_type": "GitHub PAT (fine-grained, read-only works)",
    "url": "https://github.com/github/github-mcp-server",
    "stars": 33166,
    "clients": [
      "claude",
      "claude-code",
      "cursor",
      "vscode",
      "windsurf",
      "zed"
    ],
    "tags": [
      "git",
      "devops",
      "issues",
      "pull-requests",
      "essential"
    ],
    "verified": "2026-09-24",
    "verified_by": "@seed-import",
    "status": "active",
    "notes": "A hosted remote variant is available at https://api.githubcopilot.com/mcp/ if you would rather not run Docker."
  },
  {
    "id": "playwright-mcp",
    "name": "Playwright MCP",
    "maintainer": "Microsoft",
    "description": "Browser automation over accessibility snapshots rather than screenshots — deterministic agent browsing in Chromium, Firefox and WebKit.",
    "install": "npx -y @playwright/mcp@latest",
    "transport": [
      "stdio",
      "http"
    ],
    "official": true,
    "language": "typescript",
    "tools_exposed": 22,
    "requires_auth": false,
    "url": "https://github.com/microsoft/playwright-mcp",
    "stars": 37530,
    "clients": [
      "claude-code",
      "cursor",
      "vscode",
      "windsurf",
      "cline"
    ],
    "tags": [
      "browser",
      "automation",
      "testing",
      "scraping",
      "essential"
    ],
    "verified": "2026-09-24",
    "verified_by": "@seed-import",
    "status": "active",
    "notes": "Accessibility-tree snapshots use far fewer tokens than screenshot-based browser agents."
  },
  {
    "id": "chrome-devtools-mcp",
    "name": "Chrome DevTools MCP",
    "maintainer": "Google Chrome DevTools team",
    "description": "Drives a real Chrome instance for performance traces, console errors and network inspection.",
    "install": "npx -y chrome-devtools-mcp@latest",
    "transport": [
      "stdio"
    ],
    "official": true,
    "language": "typescript",
    "requires_auth": false,
    "url": "https://github.com/ChromeDevTools/chrome-devtools-mcp",
    "stars": 52550,
    "clients": [
      "claude-code",
      "cursor",
      "vscode"
    ],
    "tags": [
      "browser",
      "debugging",
      "performance",
      "frontend"
    ],
    "verified": "2026-09-24",
    "verified_by": "@seed-import",
    "status": "active"
  },
  {
    "id": "notion-mcp",
    "name": "Notion MCP",
    "maintainer": "Notion",
    "description": "Reads and writes Notion pages and databases — the cleanest way to give an agent a knowledge base you already maintain.",
    "install": "npx -y @notionhq/notion-mcp-server",
    "transport": [
      "stdio",
      "http"
    ],
    "official": true,
    "language": "typescript",
    "requires_auth": true,
    "auth_type": "Notion internal integration token",
    "url": "https://github.com/makenotion/notion-mcp-server",
    "docs_url": "https://developers.notion.com/docs/mcp",
    "stars": 4644,
    "clients": [
      "claude",
      "claude-code",
      "cursor",
      "vscode",
      "windsurf"
    ],
    "tags": [
      "notes",
      "knowledge-base",
      "productivity"
    ],
    "verified": "2026-09-24",
    "verified_by": "@seed-import",
    "status": "active",
    "notes": "Remember to share the specific pages with the integration — a token alone grants nothing."
  },
  {
    "id": "sentry-mcp",
    "name": "Sentry MCP",
    "maintainer": "Sentry",
    "description": "Pulls issues, stack traces and traces into the prompt so an agent can triage production errors.",
    "install": "npx -y @sentry/mcp-server@latest",
    "transport": [
      "stdio",
      "http"
    ],
    "official": true,